title,link,summary,date,source,cleaned,sentiment#,sentiment,trump,biden
Dissecting Laura Ingraham’s attempt to gin up a mystery around coronavirus in New York,https://www.washingtonpost.com/politics/2020/04/29/dissecting-laura-ingrahams-attempt-gin-up-mystery-around-coronavirus-new-york/?utm_source=rss&utm_medium=referral&utm_campaign=wp_politics,She spent most of the introduction to her show on Tuesday suggesting sketchiness with the state's flu data.,2020-04-29 11:26:15,http://www.washingtonpost.com/pb/politics/,dissecting laura ingrahams attempt to gin up a mystery around coronavirus in new york she spent most of the introduction to her show on tuesday suggesting sketchiness with the states flu data,-0.3818,negative,0,0
Justin Amash could have a big impact on the 2020 presidential race. But how?,https://www.washingtonpost.com/politics/2020/04/29/justin-amash-could-have-big-impact-2020-presidential-race-how/?utm_source=rss&utm_medium=referral&utm_campaign=wp_politics,"The case for the former Republican being a significant presence in the 2020 race is readily apparent. Who it will benefit isn't clear, though.",2020-04-29 11:13:13,http://www.washingtonpost.com/pb/politics/,justin amash could have a big impact on the 2020 presidential race but how the case for the former republican being a significant presence in the 2020 race is readily apparent who it will benefit isnt clear though,0.5305,positive,0,0
These lawyers say Trump’s name on stimulus checks might be a crime,https://www.washingtonpost.com/politics/these-lawyers-say-donald-j-trumps-name-should-not-be-on-stimulus-checks/2020/04/29/086ac1bc-88cc-11ea-9759-6d20ba0f2c0e_story.html?utm_source=rss&utm_medium=referral&utm_campaign=wp_politics,Three prominent lawyers say a special prosector should investigate whether government employees and property are being used to promote the president’s reelection campaign.,2020-04-29 10:11:00,http://www.washingtonpost.com/pb/politics/,these lawyers say trumps name on stimulus checks might be a crime three prominent lawyers say a special prosector should investigate whether government employees and property are being used to promote the presidents reelection campaign,0.4767,positive,1,0
The Daily 202: Human rights groups sound alarm over government crackdowns during coronavirus,https://www.washingtonpost.com/politics/the-daily-202-human-rights-groups-sound-alarm-over-government-crackdowns-during-coronavirus/2020/04/29/cd2562b3-4e60-431f-bbcc-dfef12b07242_story.html?utm_source=rss&utm_medium=referral&utm_campaign=wp_politics,El Salvador’s president uses pandemic to launch crackdown on gangs.,2020-04-29 09:19:33,http://www.washingtonpost.com/pb/politics/,the daily 202 human rights groups sound alarm over government crackdowns during coronavirus el salvadors president uses pandemic to launch crackdown on gangs,-0.34,negative,0,0
The Technology 202: Google earnings signal a tale of two tech industries,https://www.washingtonpost.com/politics/the-technology-202-google-earnings-signal-a-tale-of-two-tech-industries/2020/04/29/bb4347a7-fd0d-4687-a8f1-c997d1fd25f0_story.html?utm_source=rss&utm_medium=referral&utm_campaign=wp_politics,The results were bad news for companies that rely on digital advertising. But enterprise software makers could be more insulated.,2020-04-29 09:00:40,http://www.washingtonpost.com/pb/politics/,the technology 202 google earnings signal a tale of two tech industries the results were bad news for companies that rely on digital advertising but enterprise software makers could be more insulated,-0.3071,negative,0,0
The Energy 202: Oil companies have a new lobbying target during pandemic — the Federal Reserve,https://www.washingtonpost.com/politics/the-energy-202-oil-companies-have-a-new-lobbying-target-during-pandemic-the-federal-reserve/2020/04/29/8b93f729-f927-4a42-b746-7aec9d79f570_story.html?utm_source=rss&utm_medium=referral&utm_campaign=wp_politics,Struggling petroleum producers want more flexible terms on loans and other aid.,2020-04-29 08:08:17,http://www.washingtonpost.com/pb/politics/,the energy 202 oil companies have a new lobbying target during pandemic the federal reserve struggling petroleum producers want more flexible terms on loans and other aid,0.1263,neutral,0,0
The Finance 202: China hawks seize on coronavirus to push for an economic split,https://www.washingtonpost.com/politics/the-finance-202-china-hawks-seize-on-coronavirus-to-push-for-an-economic-split/2020/04/29/894b6244-44de-45e3-91e9-6e4b73ef71e1_story.html?utm_source=rss&utm_medium=referral&utm_campaign=wp_politics,Trump himself is vacillating on how tough a line to take with Beijing.,2020-04-29 08:04:34,http://www.washingtonpost.com/pb/politics/,the finance 202 china hawks seize on coronavirus to push for an economic split trump himself is vacillating on how tough a line to take with beijing,-0.128,neutral,1,0
The Health 202: Millions of Americans were infected with coronavirus and had no symptoms,https://www.washingtonpost.com/politics/the-health-202-millions-of-americans-were-infected-with-coronavirus-and-had-no-symptoms/2020/04/29/a0928d85-6c64-40d5-bb48-53f7302341f6_story.html?utm_source=rss&utm_medium=referral&utm_campaign=wp_politics,But the hopes for “herd immunity” to stop the spread naturally are dim.,2020-04-29 07:38:48,http://www.washingtonpost.com/pb/politics/,the health 202 millions of americans were infected with coronavirus and had no symptoms but the hopes for herd immunity to stop the spread naturally are dim,-0.2023,negative,0,0
The Cybersecurity 202: Americans are wary of the coronavirus tracking apps being produced by big tech,https://www.washingtonpost.com/politics/the-cybersecurity-202-americans-are-wary-of-the-coronavirus-tracking-apps-being-produced-by-big-tech/2020/04/29/f2dd3272-33bd-4eb0-898b-d5250d94b266_story.html?utm_source=rss&utm_medium=referral&utm_campaign=wp_politics,Less than half of Americans willing to download software from Apple and Google.,2020-04-29 07:33:45,http://www.washingtonpost.com/pb/politics/,the cybersecurity 202 americans are wary of the coronavirus tracking apps being produced by big tech less than half of americans willing to download software from apple and google,0.0,neutral,0,0
Power Up: Governors-turned-senators take up the charge for state aid in Congress,https://www.washingtonpost.com/politics/power-up-governors-turned-senators-take-up-the-charge-for-state-aid-in-congress/2020/04/29/c5b5482f-2bfd-4dc4-98f7-08832ae0ac8f_story.html?utm_source=rss&utm_medium=referral&utm_campaign=wp_politics,"It’s the half-trillion-dollar question, as lawmakers eye another relief package.",2020-04-29 06:36:48,http://www.washingtonpost.com/pb/politics/,power up governorsturnedsenators take up the charge for state aid in congress its the halftrilliondollar question as lawmakers eye another relief package,0.4767,positive,0,0
"His name on stimulus checks, Trump sends a gushing letter to 90 million people",https://www.washingtonpost.com/politics/his-name-on-stimulus-checks-trump-sends-a-gushing-letter-to-90-million-people/2020/04/28/04143a62-8999-11ea-ac8a-fe9b8088e101_story.html?utm_source=rss&utm_medium=referral&utm_campaign=wp_politics,The president is now sending letters required by law to those who have received economic relief payments. Some recipients say the letter seems political.,2020-04-29 03:04:00,http://www.washingtonpost.com/pb/politics/,his name on stimulus checks trump sends a gushing letter to 90 million people the president is now sending letters required by law to those who have received economic relief payments some recipients say the letter seems political,0.4767,positive,1,0
"White House's Social Distancing Guidelines Will Be 'Fading Out,' Trump Says",https://www.npr.org/sections/coronavirus-live-updates/2020/04/29/848025672/white-houses-social-distancing-guidelines-will-be-fading-out-trump-says?utm_medium=RSS&utm_campaign=news,The current coronavirus guidelines that were set to expire Thursday will not be extended as more governors begin steps to reopen their economies.,2020-04-29 17:39:32-04:00,https://www.npr.org/templates/story/story.php?storyId=1001,white houses social distancing guidelines will be fading out trump says the current coronavirus guidelines that were set to expire thursday will not be extended as more governors begin steps to reopen their economies,0.0,neutral,1,0
Taiwan's Coronavirus Moment — And Delicate Balancing Act,https://www.npr.org/2020/04/29/847308433/taiwans-coronavirus-moment-and-delicate-balancing-act?utm_medium=RSS&utm_campaign=news,"The pandemic provides an opportunity for Taiwan to raise its international profile. But that is unlikely to go over well in Beijing, which is facing pressures for its own handling of the virus.",2020-04-29 17:04:22-04:00,https://www.npr.org/templates/story/story.php?storyId=1001,taiwans coronavirus moment  and delicate balancing act the pandemic provides an opportunity for taiwan to raise its international profile but that is unlikely to go over well in beijing which is facing pressures for its own handling of the virus,0.1779,neutral,0,0
Grocery Cashier Is 'Putting A Little Positivity' Into Seniors' Shopping Trips,https://www.npr.org/sections/coronavirus-live-updates/2020/04/29/847939335/grocery-cashier-is-putting-a-little-positivity-into-seniors-shopping-trips?utm_medium=RSS&utm_campaign=news,"Grocery stores have carved out special shopping times for seniors and others. ""Just to be able to spend that one-on-one time with ... them. They definitely make me laugh,"" Courtney Meadows says.",2020-04-29 16:10:58-04:00,https://www.npr.org/templates/story/story.php?storyId=1001,grocery cashier is putting a little positivity into seniors shopping trips grocery stores have carved out special shopping times for seniors and others just to be able to spend that oneonone time with  them they definitely make me laugh courtney meadows says,0.9002,positive,0,0
New Coronavirus Safety Measures Pose Challenges For The Deaf And Hard-Of-Hearing,https://www.npr.org/2020/04/29/847925057/new-coronavirus-safety-measures-pose-challenges-for-the-deaf-and-hard-of-hearing?utm_medium=RSS&utm_campaign=news,Covered faces means people who are deaf or hard-of hearing can't lip-read or follow facial expressions. And hospitals' tightened visitor restrictions may bar interpreters from medical appointments.,2020-04-29 15:44:45-04:00,https://www.npr.org/templates/story/story.php?storyId=1001,new coronavirus safety measures pose challenges for the deaf and hardofhearing covered faces means people who are deaf or hardof hearing cant lipread or follow facial expressions and hospitals tightened visitor restrictions may bar interpreters from medical appointments,0.4767,positive,0,0
Scram Big Banks: Small Lenders Take Over SBA Lending Program (For A Night),https://www.npr.org/sections/coronavirus-live-updates/2020/04/29/847940090/scram-big-banks-small-lenders-take-over-sba-lending-program-for-a-night?utm_medium=RSS&utm_campaign=news,"The SBA chief announced that only small banks will be given access to the Payroll Protection Program for eight hours, after heavy criticism that the program had given money to well-known businesses.",2020-04-29 15:15:53-04:00,https://www.npr.org/templates/story/story.php?storyId=1001,scram big banks small lenders take over sba lending program for a night the sba chief announced that only small banks will be given access to the payroll protection program for eight hours after heavy criticism that the program had given money to wellknown businesses,-0.4404,negative,0,0
Why The U.S. Government Stopped Funding A Research Project On Bats And Coronaviruses,https://www.npr.org/sections/goatsandsoda/2020/04/29/847948272/why-the-u-s-government-stopped-funding-a-research-project-on-bats-and-coronaviru?utm_medium=RSS&utm_campaign=news,"The project, run by the nonprofit EcoHealth Alliance, aimed to identify places to monitor, come up with strategies to prevent spillover of the virus and get a jump on creating vaccines and treatments.",2020-04-29 15:08:34-04:00,https://www.npr.org/templates/story/story.php?storyId=1001,why the us government stopped funding a research project on bats and coronaviruses the project run by the nonprofit ecohealth alliance aimed to identify places to monitor come up with strategies to prevent spillover of the virus and get a jump on creating vaccines and treatments,0.1027,neutral,0,0
"Compared With China, U.S. Stay-At-Home Has Been 'Giant Garden Party,' Journalist Says",https://www.npr.org/sections/health-shots/2020/04/29/847755751/compared-to-china-u-s-stay-at-home-has-been-a-giant-garden-party-journalist-says?utm_medium=RSS&utm_campaign=news,,2020-04-29 15:06:00-04:00,https://www.npr.org/templates/story/story.php?storyId=1001,compared with china us stayathome has been giant garden party journalist says ,0.4019,positive,0,0
"He's Immunocompromised. She's An ER Doctor. They Are Living Together, Apart",https://www.npr.org/sections/coronavirus-live-updates/2020/04/29/846495546/hes-immunocompromised-she-s-an-er-doctor-they-are-living-together-apart?utm_medium=RSS&utm_campaign=news,"Wendy Jackson, a pediatric emergency doctor, is working through the coronavirus crisis. Her husband, Robert, had a kidney transplant four years ago. They keep 6 to 8 feet between themselves at home.",2020-04-29 15:04:00-04:00,https://www.npr.org/templates/story/story.php?storyId=1001,hes immunocompromised shes an er doctor they are living together apart wendy jackson a pediatric emergency doctor is working through the coronavirus crisis her husband robert had a kidney transplant four years ago they keep 6 to 8 feet between themselves at home,-0.7717,negative,0,0
Internal ICE Reviews Of Two Immigrant Deaths Stoke Fears About COVID-19 Care,https://www.npr.org/2020/04/29/847838342/internal-ice-reviews-of-two-immigrant-deaths-stoke-fears-about-covid-19-care?utm_medium=RSS&utm_campaign=news,"As COVID-19 spreads in detention, ICE documents shared with NPR reveal new details about the health care provided to two immigrants who died in 2017. Those facilities now face coronavirus outbreaks.",2020-04-29 14:31:00-04:00,https://www.npr.org/templates/story/story.php?storyId=1001,internal ice reviews of two immigrant deaths stoke fears about covid19 care as covid19 spreads in detention ice documents shared with npr reveal new details about the health care provided to two immigrants who died in 2017 those facilities now face coronavirus outbreaks,-0.0258,neutral,0,0
Doctors Link COVID-19 To Potentially Deadly Blood Clots And Strokes,https://www.npr.org/sections/health-shots/2020/04/29/847917017/doctors-link-covid-19-to-potentially-deadly-blood-clots-and-strokes?utm_medium=RSS&utm_campaign=news,"COVID-19 appears to thicken the blood of many patients, making them vulnerable to clots that can damage the lungs, kidneys and brain.",2020-04-29 14:29:27-04:00,https://www.npr.org/templates/story/story.php?storyId=1001,doctors link covid19 to potentially deadly blood clots and strokes covid19 appears to thicken the blood of many patients making them vulnerable to clots that can damage the lungs kidneys and brain,-0.6249,negative,0,0
"Lyft Lays Off Nearly 1,000 Employees As Virus Saps Demand For Rides",https://www.npr.org/sections/coronavirus-live-updates/2020/04/29/847904818/lyft-lays-off-nearly-1-000-employees-as-virus-saps-demand-for-rides?utm_medium=RSS&utm_campaign=news,The ride-hailing company is also furloughing hundreds of workers and cutting pay as it tries to reduce costs during the coronavirus pandemic.,2020-04-29 14:22:08-04:00,https://www.npr.org/templates/story/story.php?storyId=1001,lyft lays off nearly 1000 employees as virus saps demand for rides the ridehailing company is also furloughing hundreds of workers and cutting pay as it tries to reduce costs during the coronavirus pandemic,-0.34,negative,0,0
"In France, A New App Is Helping Doctors Monitor COVID-19 Patients Remotely",https://www.npr.org/2020/04/29/847171229/in-paris-a-new-app-is-helping-doctors-monitor-covid-19-patients-remotely?utm_medium=RSS&utm_campaign=news,The Covidom app allows thousands of patients with non-critical cases of COVID-19 to ride the virus out at home. They answer questions on a range of health indicators and doctors follow up by phone.,2020-04-29 14:21:00-04:00,https://www.npr.org/templates/story/story.php?storyId=1001,in france a new app is helping doctors monitor covid19 patients remotely the covidom app allows thousands of patients with noncritical cases of covid19 to ride the virus out at home they answer questions on a range of health indicators and doctors follow up by phone,0.29600000000000004,positive,0,0
Kweisi Mfume Wins Special Election To Fill Elijah Cummings' Seat In Congress,https://www.npr.org/2020/04/29/847886016/kweisi-mfume-wins-special-election-to-fill-elijah-cummings-seat-in-congress?utm_medium=RSS&utm_campaign=news,Voters return Kweisi Mfume to the seat he held for five terms; he was replaced by the late Elijah Cummings in 1996.,2020-04-29 14:08:54-04:00,https://www.npr.org/templates/story/story.php?storyId=1001,kweisi mfume wins special election to fill elijah cummings seat in congress voters return kweisi mfume to the seat he held for five terms he was replaced by the late elijah cummings in 1996,0.7506,positive,0,0
Don't Skip Your Child's Well Check: Delays In Vaccines Could Add Up To Big Problems,https://www.npr.org/sections/health-shots/2020/04/29/840347518/dont-skip-your-childs-well-check-delays-in-vaccines-could-add-up-to-big-problems?utm_medium=RSS&utm_campaign=news,Telemedicine has its limits. And postponing shots could lead to a resurgence of diseases like measles. Doctors are taking steps to make their offices safe for kids who need to come in.,2020-04-29 13:19:00-04:00,https://www.npr.org/templates/story/story.php?storyId=1001,dont skip your childs well check delays in vaccines could add up to big problems telemedicine has its limits and postponing shots could lead to a resurgence of diseases like measles doctors are taking steps to make their offices safe for kids who need to come in,0.5106,positive,0,0
Navy Seeks 'Deeper Review' In Probe Of Pandemic-Struck Warship Captain's Firing,https://www.npr.org/sections/coronavirus-live-updates/2020/04/29/847842205/navy-seeks-deeper-review-in-probe-of-pandemic-struck-warship-captain-s-firing?utm_medium=RSS&utm_campaign=news,"The acting Navy secretary says unanswered questions remain, after an initial probe into the removal of Capt. Brett Crozier from command of the coronavirus-infected USS Theodore Roosevelt.",2020-04-29 12:41:32-04:00,https://www.npr.org/templates/story/story.php?storyId=1001,navy seeks deeper review in probe of pandemicstruck warship captains firing the acting navy secretary says unanswered questions remain after an initial probe into the removal of capt brett crozier from command of the coronavirusinfected uss theodore roosevelt,-0.4767,negative,0,0
"U.S. economy faces hard slog back from pandemic, Fed chief says",http://feeds.reuters.com/~r/reuters/topNews/~3/FrWxJr4tbOo/u-s-economy-faces-hard-slog-back-from-pandemic-fed-chief-says-idUSKCN22B0EA,"The head of the Federal Reserve on Wednesday dashed lingering hopes for a fast rebound from the coronavirus pandemic, saying the U.S. economy could feel the weight of consumer fear and social distancing for a year or more in a prolonged climb from a deepening hole.",2020-04-29 17:38:35-04:00,reuters/topnews,us economy faces hard slog back from pandemic fed chief says the head of the federal reserve on wednesday dashed lingering hopes for a fast rebound from the coronavirus pandemic saying the us economy could feel the weight of consumer fear and social distancing for a year or more in a prolonged climb from a deepening hole,-0.2023,negative,0,0
U.S. congressional Democrats push for coronavirus medical supply czar,http://feeds.reuters.com/~r/reuters/topNews/~3/ElxHwzItJhU/u-s-congressional-democrats-push-for-coronavirus-medical-supply-czar-idUSKBN22B2BA,"Congressional Democrats on Wednesday proposed a bill that would require a U.S. coronavirus supply czar to oversee critical medical supplies, while the top Senate Republican doubled down on demands for business protections.",2020-04-29 17:32:38-04:00,reuters/topnews,us congressional democrats push for coronavirus medical supply czar congressional democrats on wednesday proposed a bill that would require a us coronavirus supply czar to oversee critical medical supplies while the top senate republican doubled down on demands for business protections,-0.128,neutral,0,0
U.S. Navy to carry out deeper review of coronavirus-hit ship,http://feeds.reuters.com/~r/reuters/topNews/~3/FCGeR4uQkSM/u-s-navy-to-carry-out-deeper-review-of-coronavirus-hit-ship-idUSKBN22B3A3,"The U.S. Navy on Wednesday said that it would carry out a broader review into the spread of the coronavirus aboard an aircraft carrier, a move likely to delay a decision on the future of the ship's fired captain.",2020-04-29 17:30:50-04:00,reuters/topnews,us navy to carry out deeper review of coronavirushit ship the us navy on wednesday said that it would carry out a broader review into the spread of the coronavirus aboard an aircraft carrier a move likely to delay a decision on the future of the ships fired captain,-0.7003,negative,0,0
"U.S. coronavirus outbreak soon to be deadlier than any flu since 1967 as deaths top 60,000",http://feeds.reuters.com/~r/reuters/topNews/~3/bg650iIB-Zs/u-s-coronavirus-outbreak-soon-to-be-deadlier-than-any-flu-since-1967-as-deaths-top-60000-idUSKBN22B32C,"U.S. deaths from the novel coronavirus topped 60,000 on Wednesday and the outbreak will soon be deadlier than any flu season since 1967, according to a Reuters tally.",2020-04-29 17:15:06-04:00,reuters/topnews,us coronavirus outbreak soon to be deadlier than any flu since 1967 as deaths top 60000 us deaths from the novel coronavirus topped 60000 on wednesday and the outbreak will soon be deadlier than any flu season since 1967 according to a reuters tally,-0.2732,negative,0,0
"Pompeo says no sight of North Korea's Kim, real risk of famine in country",http://feeds.reuters.com/~r/reuters/topNews/~3/6DG0qL2wh-8/pompeo-says-no-sight-of-north-koreas-kim-real-risk-of-famine-in-country-idUSKBN22B20X,"The United States has caught no sight of North Korean leader Kim Jong Un and is watching reports about his health, U.S. Secretary of State Mike Pompeo said on Wednesday, adding there was a real risk of famine in the country amid the coronavirus outbreak.",2020-04-29 17:13:19-04:00,reuters/topnews,pompeo says no sight of north koreas kim real risk of famine in country the united states has caught no sight of north korean leader kim jong un and is watching reports about his health us secretary of state mike pompeo said on wednesday adding there was a real risk of famine in the country amid the coronavirus outbreak,-0.5859,negative,0,0
Brazil's Bolsonaro withdraws name of family friend as top cop,http://feeds.reuters.com/~r/reuters/topNews/~3/h31YFCDaEIw/brazils-bolsonaro-withdraws-name-of-family-friend-as-top-cop-idUSKBN22B20N,"Brazilian President Jair Bolsonaro on Wednesday withdrew the name of a family friend he had picked to run the federal police,  after a Supreme Court justice blocked an appointment that opponents said would allow him inappropriate influence over law enforcement.",2020-04-29 17:06:08-04:00,reuters/topnews,brazils bolsonaro withdraws name of family friend as top cop brazilian president jair bolsonaro on wednesday withdrew the name of a family friend he had picked to run the federal police  after a supreme court justice blocked an appointment that opponents said would allow him inappropriate influence over law enforcement,0.9325,positive,0,0
"Biden weighs naming cabinet officials before election, including Republicans",http://feeds.reuters.com/~r/reuters/topNews/~3/wVZ40wIWF_Q/biden-weighs-naming-cabinet-officials-before-election-including-republicans-idUSKBN22B384,Democratic presidential candidate Joe Biden said on Wednesday he would consider announcing the names of some cabinet officials before the election - and that some of the people might be Republicans.,2020-04-29 17:01:00-04:00,reuters/topnews,biden weighs naming cabinet officials before election including republicans democratic presidential candidate joe biden said on wednesday he would consider announcing the names of some cabinet officials before the election  and that some of the people might be republicans,0.0,neutral,0,1
New York's Cuomo assails politicizing of virus as data shows U.S. economy shrank,http://feeds.reuters.com/~r/reuters/topNews/~3/qWQDEfQqt2U/new-yorks-cuomo-assails-politicizing-of-virus-as-data-shows-u-s-economy-shrank-idUSKBN22B23C,"New York Governor Andrew Cuomo accused U.S. political leaders of dangerous partisanship in their response to the coronavirus pandemic, while new data on Wednesday confirmed that shutdowns to fight the outbreak had severely crippled the economy.",2020-04-29 16:57:47-04:00,reuters/topnews,new yorks cuomo assails politicizing of virus as data shows us economy shrank new york governor andrew cuomo accused us political leaders of dangerous partisanship in their response to the coronavirus pandemic while new data on wednesday confirmed that shutdowns to fight the outbreak had severely crippled the economy,-0.872,negative,0,0
