title,link,summary,date,source,cleaned,sentiment#,sentiment,trump,biden
World's smallest restaurant will have a table for one,http://rss.cnn.com/~r/rss/cnn_topstories/~3/xA3Dpw6mU1M/index.html,"The cost of a three-course meal at Bord For En (Table For One), a pop-up restaurant in Sweden opening May 10, is left to the diner's discretion.",2020-05-01 11:31:42+00:00,rss/cnn_topstories,worlds smallest restaurant will have a table for one the cost of a threecourse meal at bord for en table for one a popup restaurant in sweden opening may 10 is left to the diners discretion,0.0,neutral,0,0
Welcome to the most expensive US stock market in two decades,http://rss.cnn.com/~r/rss/cnn_topstories/~3/gvus8eRrC78/index.html,The coronavirus pandemic has exposed a gaping disconnect between unprecedented economic pain on Main Street and extreme optimism on Wall Street.,2020-05-01 14:47:35+00:00,rss/cnn_topstories,welcome to the most expensive us stock market in two decades the coronavirus pandemic has exposed a gaping disconnect between unprecedented economic pain on main street and extreme optimism on wall street,0.4404,positive,0,0
These are the stocks Covid-19 is impacting the most -- and the least,http://rss.cnn.com/~r/rss/cnn_topstories/~3/DERt_54GXP0/coronavirus,,no date,rss/cnn_topstories,these are the stocks covid19 is impacting the most  and the least ,0.0,neutral,0,0
Warren Buffett has $130 billion to rescue Corporate America,http://rss.cnn.com/~r/rss/cnn_topstories/~3/tRDq6yVsp20/index.html,"Tens of thousands of people typically flock to Omaha each year for the Berkshire Hathaway annual shareholder meeting. This year, fans of Warren Buffett will have no choice but to watch him online.",2020-05-01 13:54:34+00:00,rss/cnn_topstories,warren buffett has 130 billion to rescue corporate america tens of thousands of people typically flock to omaha each year for the berkshire hathaway annual shareholder meeting this year fans of warren buffett will have no choice but to watch him online,0.1406,neutral,0,0
Trump's strongman diplomacy is coming apart,http://rss.cnn.com/~r/rss/cnn_topstories/~3/y4etJSnKSQA/index.html,"For three and a half years, Donald Trump has bet whatever global order he has fantasized on a diplomacy based on mano-a-mano relationships with strongmen and dictators. Now, in the age of Covid-19, this is all largely coming apart.",2020-04-30 23:49:25+00:00,rss/cnn_topstories,trumps strongman diplomacy is coming apart for three and a half years donald trump has bet whatever global order he has fantasized on a diplomacy based on manoamano relationships with strongmen and dictators now in the age of covid19 this is all largely coming apart,0.29600000000000004,positive,1,0
Critical responders we're ignoring in pandemic,http://rss.cnn.com/~r/rss/cnn_topstories/~3/Nz_NgV3-s5Q/index.html,President Donald Trump has said our nation is at war. But neither he nor the federal government are yet providing the guidance or funding necessary to deploy all of the right troops needed to win.,2020-05-01 11:45:17+00:00,rss/cnn_topstories,critical responders were ignoring in pandemic president donald trump has said our nation is at war but neither he nor the federal government are yet providing the guidance or funding necessary to deploy all of the right troops needed to win,0.3071,positive,1,0
The perfect TV format for enduring a shutdown,http://rss.cnn.com/~r/rss/cnn_topstories/~3/ysWn7Y0tAD8/index.html,"We may be living in the age of prestige TV, but over the past few weeks, I've found it difficult to watch anything other than sitcoms. Anyone who knows me would say that this is hardly a departure for me -- pandemic or not -- but there's more to it.",2020-04-30 22:31:59+00:00,rss/cnn_topstories,the perfect tv format for enduring a shutdown we may be living in the age of prestige tv but over the past few weeks ive found it difficult to watch anything other than sitcoms anyone who knows me would say that this is hardly a departure for me  pandemic or not  but theres more to it,-0.2263,negative,0,0
The reason Trump mistreats meatpacking workers,http://rss.cnn.com/~r/rss/cnn_topstories/~3/bTDzUCuJE3E/index.html,"Get back to work, says President Trump. He might as well add: even if it might kill you.",2020-04-30 17:50:45+00:00,rss/cnn_topstories,the reason trump mistreats meatpacking workers get back to work says president trump he might as well add even if it might kill you,-0.5574,negative,1,0
What Washington's inaugural address can teach us,http://rss.cnn.com/~r/rss/cnn_topstories/~3/oRJ5NQp9Nyo/index.html,It was morning again in America.,2020-05-01 01:30:31+00:00,rss/cnn_topstories,what washingtons inaugural address can teach us it was morning again in america,0.0,neutral,0,0
Officials removing bodies from 'overwhelmed' Brooklyn funeral home,http://rss.cnn.com/~r/rss/cnn_topstories/~3/94ELGn2aszs/index.html,"Officials were back at a Brooklyn funeral home Thursday, removing bodies that weren't properly cared for inside the home, a law enforcement official tells CNN.",2020-05-01 01:24:08+00:00,rss/cnn_topstories,officials removing bodies from overwhelmed brooklyn funeral home officials were back at a brooklyn funeral home thursday removing bodies that werent properly cared for inside the home a law enforcement official tells cnn,-0.7296,negative,0,0
Georgia governor suspends road test requirement for driver's licenses,http://rss.cnn.com/~r/rss/cnn_topstories/~3/Zq-HOGdbUHY/index.html,New Georgia drivers will not be required to take a road test in order to get their license.,2020-04-30 11:23:36+00:00,rss/cnn_topstories,georgia governor suspends road test requirement for drivers licenses new georgia drivers will not be required to take a road test in order to get their license,0.0,neutral,0,0
"It may be a year before sports return to normalcy in the US, Fauci warns",http://rss.cnn.com/~r/rss/cnn_topstories/~3/nyHNpBPjLVM/index.html,A return for sports would be a return to some semblance of normalcy. But don't hold your breath.,2020-04-29 23:42:18+00:00,rss/cnn_topstories,it may be a year before sports return to normalcy in the us fauci warns a return for sports would be a return to some semblance of normalcy but dont hold your breath,-0.0516,neutral,0,0
Buddhist art: These ancient images are more timely than you think,http://rss.cnn.com/~r/rss/cnn_topstories/~3/s5yIWB47Eco/index.html,"What was the Buddha's great wisdom, and how do the artworks of the Buddhist tradition convey it to us today?",2020-04-25 15:24:52+00:00,rss/cnn_topstories,buddhist art these ancient images are more timely than you think what was the buddhas great wisdom and how do the artworks of the buddhist tradition convey it to us today,0.8176,positive,0,0
1990s fashion: A brief history of what we wore,http://rss.cnn.com/~r/rss/cnn_topstories/~3/c6SmACddxcw/index.html,"Nineties fashion was hard to pin down. A clash of trends screamed for our attention while others were so quietly cool they're still sartorial staples in our collective wardrobes: slip dresses, Doc Martens, chokers, crop tops.",2020-04-30 01:57:02+00:00,rss/cnn_topstories,1990s fashion a brief history of what we wore nineties fashion was hard to pin down a clash of trends screamed for our attention while others were so quietly cool theyre still sartorial staples in our collective wardrobes slip dresses doc martens chokers crop tops,0.4902,positive,0,0
The lone surrealist whose erotic art still provokes,http://rss.cnn.com/~r/rss/cnn_topstories/~3/2bHXeDPKZXc/index.html,"Bordeaux, France, 1968. Pierre Molinier puts on some makeup, a black eye mask covers half of his face, fishnet stockings curve around his elegant legs and a metal chain binds them to the stool he sits on. He starts photographing himself, once standing naked in front of the camera, a second time wearing a wig and his bottom facing the lens. This was a typical moment for the French photographer.",2020-04-29 12:49:05+00:00,rss/cnn_topstories,the lone surrealist whose erotic art still provokes bordeaux france 1968 pierre molinier puts on some makeup a black eye mask covers half of his face fishnet stockings curve around his elegant legs and a metal chain binds them to the stool he sits on he starts photographing himself once standing naked in front of the camera a second time wearing a wig and his bottom facing the lens this was a typical moment for the french photographer,-0.0772,neutral,0,0
Avril Lavigne honoring frontline workers with new music video,http://rss.cnn.com/~r/rss/cnn_topstories/~3/Ojv91Yoh1N8/index.html,"Sitting at her home in Los Angeles watching the coronavirus pandemic sweep across the world, singer Avril Lavigne knew she wanted to do something.",2020-05-01 16:15:10+00:00,rss/cnn_topstories,avril lavigne honoring frontline workers with new music video sitting at her home in los angeles watching the coronavirus pandemic sweep across the world singer avril lavigne knew she wanted to do something,0.5106,positive,0,0
See what's streaming in May,http://rss.cnn.com/~r/rss/cnn_topstories/~3/ivSRiXQKUtc/index.html,"More people are spending more time at home, so it's only right we give you more options for what to watch.",2020-04-30 15:24:36+00:00,rss/cnn_topstories,see whats streaming in may more people are spending more time at home so its only right we give you more options for what to watch,0.0,neutral,0,0
Andy Cohen thrilled by Anderson's baby news,http://rss.cnn.com/~r/rss/cnn_topstories/~3/ErdJXr6T37s/index.html,Anderson Cooper's son already has a playmate waiting.,2020-05-01 13:09:00+00:00,rss/cnn_topstories,andy cohen thrilled by andersons baby news anderson coopers son already has a playmate waiting,0.4404,positive,0,0
"Coronavirus Live Updates: As Some States Reopen, Others Draw Protests",https://www.nytimes.com/2020/05/01/us/coronavirus-updates.html,"At least 10 states eased restrictions on Friday. For the first time in over a year, a White House press secretary held a news briefing.",2020-05-01 19:38:37+00:00,https://www.nytimes.com/section/us,coronavirus live updates as some states reopen others draw protests at least 10 states eased restrictions on friday for the first time in over a year a white house press secretary held a news briefing,0.0772,neutral,0,0
Michigan Governor Reinstates State of Emergency as Protests Ramp Up,https://www.nytimes.com/2020/05/01/us/michigan-protests-capitol-virus-armed.html,The governor’s moves were in response to the Republican-led Legislature’s refusal to extend the original emergency declaration.,2020-05-01 18:17:54+00:00,https://www.nytimes.com/section/us,michigan governor reinstates state of emergency as protests ramp up the governors moves were in response to the republicanled legislatures refusal to extend the original emergency declaration,-0.4767,negative,0,0
Two Arrested in Killings of Transgender Women in Puerto Rico,https://www.nytimes.com/2020/04/30/us/puerto-rico-transgender-murder-arrests.html,The police said they had classified the deaths as a hate crime after the remains of two women were found in a badly burned car last week.,2020-05-01 00:36:06+00:00,https://www.nytimes.com/section/us,two arrested in killings of transgender women in puerto rico the police said they had classified the deaths as a hate crime after the remains of two women were found in a badly burned car last week,-0.9578,negative,0,0
Gavin Newsom Orders Orange County Beaches Closed Due to Coronavirus,https://www.nytimes.com/2020/04/30/us/newsom-beaches-california-coronavirus.html,"Images of packed shores have prompted a furor against officials in coastal states like California and Florida, who have resisted statewide beach closure orders.",2020-05-01 19:33:11+00:00,https://www.nytimes.com/section/us,gavin newsom orders orange county beaches closed due to coronavirus images of packed shores have prompted a furor against officials in coastal states like california and florida who have resisted statewide beach closure orders,0.3612,positive,0,0
Drive-Throughs Are Now a Lifeline for Fast Food Chains,https://www.nytimes.com/2020/05/01/business/coronavirus-fast-food-drive-throughs.html,"With dine-in restaurants shuttered and social distancing paramount, drive-throughs are now providing a crucial source of revenue during the pandemic.",2020-05-01 18:38:26+00:00,https://www.nytimes.com/section/us,drivethroughs are now a lifeline for fast food chains with dinein restaurants shuttered and social distancing paramount drivethroughs are now providing a crucial source of revenue during the pandemic,0.0,neutral,0,0
"The Coronavirus Still Is a Global Health Emergency, W.H.O. Warns",https://www.nytimes.com/2020/05/01/health/coronavirus-who-emergency.html,"Even as some governments contemplate reopening, the spread of the virus has accelerated in countries in Africa and South America.",2020-05-01 19:07:09+00:00,https://www.nytimes.com/section/us,the coronavirus still is a global health emergency who warns even as some governments contemplate reopening the spread of the virus has accelerated in countries in africa and south america,-0.4588,negative,0,0
The Hunt for Moby Dick Moves Online,https://www.nytimes.com/2020/05/01/books/moby-dick-annual-marathon.html,"Every year, the New Bedford Whaling Museum hosts a marathon reading of “Moby-Dick.” For the social distancing edition, volunteers are recording performances from home.",2020-05-01 17:45:09+00:00,https://www.nytimes.com/section/us,the hunt for moby dick moves online every year the new bedford whaling museum hosts a marathon reading of mobydick for the social distancing edition volunteers are recording performances from home,-0.5106,negative,0,0
"Blood Pressure Drugs Don’t Increase Coronavirus Risk, Studies Find",https://www.nytimes.com/2020/05/01/health/blood-pressure-drugs-coronavirus.html,"People taking widely used medicines did not face higher rates of infection or more severe illness, new research indicates.",2020-05-01 16:34:30+00:00,https://www.nytimes.com/section/us,blood pressure drugs dont increase coronavirus risk studies find people taking widely used medicines did not face higher rates of infection or more severe illness new research indicates,-0.8031,negative,0,0
Full Transcript: Joe Biden Addresses Tara Reade Allegations on ‘Morning Joe’,https://www.nytimes.com/2020/05/01/us/politics/joe-biden-tara-reade-msnbc.html,The former vice president was interviewed about the allegation made by his former Senate aide that he sexually assaulted her in 1993.,2020-05-01 15:18:33+00:00,https://www.nytimes.com/section/us,full transcript joe biden addresses tara reade allegations on morning joe the former vice president was interviewed about the allegation made by his former senate aide that he sexually assaulted her in 1993,-0.5267,negative,0,1
How to Be a Good Neighbor Now,https://www.nytimes.com/2020/05/01/style/america-neighborhoods-coronavirus.html,How we come together when we can’t go very far.,2020-05-01 18:58:15+00:00,https://www.nytimes.com/section/us,how to be a good neighbor now how we come together when we cant go very far,0.4404,positive,0,0
A Composer and Her (Very) Long String Instrument,https://www.nytimes.com/2020/05/01/arts/music/ellen-fullman.html,"Ellen Fullman is sheltering in place with the 40-string, 45-foot-long droning instrument she created decades ago.",2020-05-01 14:00:11+00:00,https://www.nytimes.com/section/us,a composer and her very long string instrument ellen fullman is sheltering in place with the 40string 45footlong droning instrument she created decades ago,0.25,positive,0,0
Coronavirus in California: Newsom Orders Beaches Closed,https://www.nytimes.com/2020/05/01/us/newsom-beach-closing-california-coronavirus.html,"Friday: You probably can’t go to the beach. But restrictions on other activities have been loosened. Also: A remembrance, and photos of poppies.",2020-05-01 14:09:42+00:00,https://www.nytimes.com/section/us,coronavirus in california newsom orders beaches closed friday you probably cant go to the beach but restrictions on other activities have been loosened also a remembrance and photos of poppies,0.0,neutral,0,0
"Coronavirus, Gretchen Whitmer, Joe Biden: Your Friday Briefing",https://www.nytimes.com/2020/05/01/briefing/coronavirus-gretchen-whitmer-joe-biden.html,Here’s what you need to know.,2020-05-01 12:44:16+00:00,https://www.nytimes.com/section/us,coronavirus gretchen whitmer joe biden your friday briefing heres what you need to know,0.0,neutral,0,1
Street Art Confronts the Pandemic,https://www.nytimes.com/2020/05/01/travel/coronavirus-street-art.html,"From Norway to Colorado, street artists depict a world of masks and hand-washing (and toilet paper). One recurrent theme: a deep appreciation of health care workers.",2020-05-01 09:00:30+00:00,https://www.nytimes.com/section/us,street art confronts the pandemic from norway to colorado street artists depict a world of masks and handwashing and toilet paper one recurrent theme a deep appreciation of health care workers,0.6808,positive,0,0
A Life and Death Battle: 4 Days of Kidney Failure but No Dialysis,https://www.nytimes.com/2020/05/01/health/coronavirus-dialysis-death.html,"At the peak of the pandemic in New York, a longtime city employee joined a crush of patients in desperate need of treatment.",2020-05-01 14:39:21+00:00,https://www.nytimes.com/section/us,a life and death battle 4 days of kidney failure but no dialysis at the peak of the pandemic in new york a longtime city employee joined a crush of patients in desperate need of treatment,-0.9011,negative,0,0
Find a Vaccine. Next: Produce 300 Million Vials of It.,https://www.nytimes.com/2020/05/01/health/coronavirus-vaccine-supplies.html,Scaling up the manufacturing of syringes and other medical products required to deliver a vaccine to millions of Americans will be just as important as the vaccine itself.,2020-05-01 09:00:27+00:00,https://www.nytimes.com/section/us,find a vaccine next produce 300 million vials of it scaling up the manufacturing of syringes and other medical products required to deliver a vaccine to millions of americans will be just as important as the vaccine itself,0.2023,positive,0,0
An Accidental Navy Chief Steers His Service Through a Storm,https://www.nytimes.com/2020/05/01/us/politics/coronavirus-carrier-crozier-gilday-trump.html,Adm. Michael M. Gilday appears determined that his recommendations on the Roosevelt case will be made based on Navy principles and not on fears of what the White House might want.,2020-05-01 15:05:29+00:00,https://www.nytimes.com/section/us,an accidental navy chief steers his service through a storm adm michael m gilday appears determined that his recommendations on the roosevelt case will be made based on navy principles and not on fears of what the white house might want,0.5764,positive,0,0
A Crime Novelist on the Oakland County Child Killer Case,https://www.nytimes.com/2020/05/01/us/oakland-county-child-killer-detroit-true-crime.html,"The still-unsolved Oakland County Child Killer case lodged in the author Megan Abbott’s psyche, even if she didn’t know it at the time.",2020-05-01 09:00:20+00:00,https://www.nytimes.com/section/us,a crime novelist on the oakland county child killer case the stillunsolved oakland county child killer case lodged in the author megan abbotts psyche even if she didnt know it at the time,-0.9201,negative,0,0
Biden Denies Tara Reade’s Assault Allegation: ‘This Never Happened’,https://www.nytimes.com/2020/05/01/us/politics/joe-biden-tara-reade-morning-joe.html,"Joseph R. Biden Jr., in his first public address of a former Senate aide’s accusation that he sexually assaulted her in 1993, called on the National Archives to release any document related to the allegation.",2020-05-01 18:23:19+00:00,https://www.nytimes.com/section/us,biden denies tara reades assault allegation this never happened joseph r biden jr in his first public address of a former senate aides accusation that he sexually assaulted her in 1993 called on the national archives to release any document related to the allegation,-0.9001,negative,0,1
#CancelRent Is New Rallying Cry for Tenants. Landlords Are Alarmed.,https://www.nytimes.com/2020/05/01/nyregion/rent-strike-coronavirus.html,"From New York to Los Angeles, tenant groups are encouraging millions of renters to withhold May rent, which landlords warn would be devastating.",2020-05-01 16:25:21+00:00,https://www.nytimes.com/section/us,cancelrent is new rallying cry for tenants landlords are alarmed from new york to los angeles tenant groups are encouraging millions of renters to withhold may rent which landlords warn would be devastating,-0.7783,negative,0,0
Anderson Cooper Announces Birth of Son Wyatt,https://www.nytimes.com/2020/05/01/us/anderson-cooper-baby-son-wyatt.html,"Wyatt Morgan Cooper, who is named after the newscaster’s late father, was delivered by a surrogate.",2020-05-01 04:28:05+00:00,https://www.nytimes.com/section/us,anderson cooper announces birth of son wyatt wyatt morgan cooper who is named after the newscasters late father was delivered by a surrogate,0.0,neutral,0,0
World Coronavirus Tracker: Live Coverage,https://www.nytimes.com/2020/05/01/world/coronavirus-news.html,"After months of a lockdown that pummeled the economy, China encourages domestic tourism. And our New Delhi correspondent paints a portrait of a fearful city.",2020-05-01 19:22:56+00:00,https://www.nytimes.com/section/us,world coronavirus tracker live coverage after months of a lockdown that pummeled the economy china encourages domestic tourism and our new delhi correspondent paints a portrait of a fearful city,-0.0772,neutral,0,0
U.S. Stocks Slump After Tech Earnings: Live Updates,https://www.nytimes.com/2020/05/01/business/stock-market-today-coronavirus.html,The latest on stock market and business news during the coronavirus outbreak.,2020-05-01 19:33:15+00:00,https://www.nytimes.com/section/us,us stocks slump after tech earnings live updates the latest on stock market and business news during the coronavirus outbreak,0.0,neutral,0,0
Labs Across U.S. Join Federal Initiative to Study Coronavirus Genome,https://www.nytimes.com/2020/04/30/science/coronavirus-genetic-sequencing.html,"The project, announced by the C.D.C., will help trace patterns of transmission, investigate outbreaks and map how the virus is evolving, which can affect a cure.",2020-05-01 03:12:50+00:00,https://www.nytimes.com/section/us,labs across us join federal initiative to study coronavirus genome the project announced by the cdc will help trace patterns of transmission investigate outbreaks and map how the virus is evolving which can affect a cure,0.5994,positive,0,0
Coronavirus Briefing: What Happened Today,https://www.nytimes.com/2020/04/30/us/coronavirus-today.html,Public beaches have become a flashpoint as the U.S. begins to emerge from stay-at-home restrictions.,2020-05-01 01:18:53+00:00,https://www.nytimes.com/section/us,coronavirus briefing what happened today public beaches have become a flashpoint as the us begins to emerge from stayathome restrictions,0.0,neutral,0,0
Oprah Winfrey to Give Commencement Address on Facebook,https://www.nytimes.com/2020/04/30/us/oprah-winfrey-graduation-commencement-speeches-virus.html,Oprah Winfrey will give a virtual commencement address on Facebook for college and high school seniors across the United States.,2020-05-01 14:39:46+00:00,https://www.nytimes.com/section/us,oprah winfrey to give commencement address on facebook oprah winfrey will give a virtual commencement address on facebook for college and high school seniors across the united states,0.4215,positive,0,0
"Peter Hunt, Who Directed the Broadway Hit ‘1776,’ Dies at 81",https://www.nytimes.com/2020/04/30/theater/peter-hunt-dead.html,"The musical about the founding fathers, his Broadway directorial debut, scored three Tonys. He was also a mainstay of the Williamstown Theater Festival.",2020-04-30 23:56:33+00:00,https://www.nytimes.com/section/us,peter hunt who directed the broadway hit 1776 dies at 81 the musical about the founding fathers his broadway directorial debut scored three tonys he was also a mainstay of the williamstown theater festival,0.4939,positive,0,0
Scrambling the Political Divide: ‘No Normal Recession’,https://www.nytimes.com/2020/04/30/us/politics/josh-hawley-missouri.html,When a Republican senator shops a stimulus plan that has more common ground with a leading progressive.,2020-04-30 23:43:27+00:00,https://www.nytimes.com/section/us,scrambling the political divide no normal recession when a republican senator shops a stimulus plan that has more common ground with a leading progressive,-0.6124,negative,0,0
Democrats Assail Mitch McConnell for Bringing Senate Back Amid Pandemic,https://www.nytimes.com/2020/04/30/us/politics/senate-coronavirus-mcconnell.html,"The majority leader’s plan to reconvene next week carries dangers for lawmakers as well as workers at the Capitol, where many low-level employees are minorities and at greater risk from Covid-19.",2020-04-30 23:30:54+00:00,https://www.nytimes.com/section/us,democrats assail mitch mcconnell for bringing senate back amid pandemic the majority leaders plan to reconvene next week carries dangers for lawmakers as well as workers at the capitol where many lowlevel employees are minorities and at greater risk from covid19,-0.1779,neutral,0,0
