title,link,summary,date,source,cleaned,sentiment#,sentiment,trump,biden
Analysis: Donald Trump's big coronavirus sacrifice? Lunch.,http://rss.cnn.com/~r/rss/cnn_topstories/~3/-R9-eFCBpJk/index.html,"President Donald Trump really, really didn't like a recent New York Times story that detailed his daily routine during the coronavirus pandemic -- including the fact that he ""arrives in the Oval Office these days as late as noon when he is usually in a sour mood after his morning marathon of television.""",2020-04-27 14:15:57+00:00,rss/cnn_topstories,analysis donald trumps big coronavirus sacrifice lunch president donald trump really really didnt like a recent new york times story that detailed his daily routine during the coronavirus pandemic  including the fact that he arrives in the oval office these days as late as noon when he is usually in a sour mood after his morning marathon of television,-0.3924,negative,1,0
New Zealand claims 'elimination' of virus,http://rss.cnn.com/~r/rss/cnn_topstories/~3/dMKVjR3P_KE/index.html,"New Zealand claimed Monday it had ""eliminated"" the coronavirus as the country announced the easing of restrictions from ""level four"" to ""level three,"" with new cases in single figures.",2020-04-27 14:47:52+00:00,rss/cnn_topstories,new zealand claims elimination of virus new zealand claimed monday it had eliminated the coronavirus as the country announced the easing of restrictions from level four to level three with new cases in single figures,0.25,positive,0,0
Analysis: Republicans' Senate majority is now in real jeopardy,http://rss.cnn.com/~r/rss/cnn_topstories/~3/jRKcZht2rPw/index.html,"The ongoing coronavirus pandemic -- and President Donald Trump's uneven (at best) handling of it -- has altered the fight for the Senate majority, handing Democrats real momentum as they seek to take back control in the fall.",2020-04-27 17:04:34+00:00,rss/cnn_topstories,analysis republicans senate majority is now in real jeopardy the ongoing coronavirus pandemic  and president donald trumps uneven at best handling of it  has altered the fight for the senate majority handing democrats real momentum as they seek to take back control in the fall,-0.128,neutral,1,0
Opinion: The court case that could change the trajectory of the Trump administration,http://rss.cnn.com/~r/rss/cnn_topstories/~3/8VByPDKwUqk/index.html,"When the Court of Appeals for the District of Columbia on Tuesday rehears the legal dispute over a congressional subpoena to former White House counsel Don McGahn, the case will hardly be about McGahn at all.",2020-04-27 17:27:30+00:00,rss/cnn_topstories,opinion the court case that could change the trajectory of the trump administration when the court of appeals for the district of columbia on tuesday rehears the legal dispute over a congressional subpoena to former white house counsel don mcgahn the case will hardly be about mcgahn at all,-0.29600000000000004,negative,1,0
Analysis: Great Depression comparisons are depressing but this time is different,http://rss.cnn.com/~r/rss/cnn_topstories/~3/n-1e1cLNEJE/index.html,"Enter the dreaded ""D"" word.",2020-04-27 15:51:21+00:00,rss/cnn_topstories,analysis great depression comparisons are depressing but this time is different enter the dreaded d word,-0.7684,negative,0,0
Scaramucci: This seems to be Trump's pandemic strategy,http://rss.cnn.com/~r/rss/cnn_topstories/~3/WTlz-ESoXGA/anthony-scaramucci-trump-coronavirus-strategy-sot-nr-vpx.cnn,Former White House Communications Director Anthony Scaramucci discusses how President Donald Trump and his administration are handling the coronavirus pandemic.,2020-04-25 23:54:33+00:00,rss/cnn_topstories,scaramucci this seems to be trumps pandemic strategy former white house communications director anthony scaramucci discusses how president donald trump and his administration are handling the coronavirus pandemic,0.0,neutral,1,0
US coronavirus cases near 1 million,http://rss.cnn.com/~r/rss/cnn_topstories/~3/-yUOWbGfGwU/index.html,A new week in the coronavirus pandemic is beginning with a United States case count approaching 1 million and several cities and states preparing to loosen stay-at-home restrictions.,2020-04-27 15:20:44+00:00,rss/cnn_topstories,us coronavirus cases near 1 million a new week in the coronavirus pandemic is beginning with a united states case count approaching 1 million and several cities and states preparing to loosen stayathome restrictions,0.4215,positive,0,0
These voters face a potential life-or-death choice,http://rss.cnn.com/~r/rss/cnn_topstories/~3/orw0ViFEGoY/index.html,Elections are a sacred ritual for Jeremy Rutledge and always have been.,2020-04-27 17:19:52+00:00,rss/cnn_topstories,these voters face a potential lifeordeath choice elections are a sacred ritual for jeremy rutledge and always have been,0.0,neutral,0,0
"'The food supply chain is breaking,' Tyson warns",http://rss.cnn.com/~r/rss/cnn_topstories/~3/Kx6OUNEAiQo/index.html,Tracking US cases | Podcast | Catch up | Timeline of events,2020-04-27 03:11:38+00:00,rss/cnn_topstories,the food supply chain is breaking tyson warns tracking us cases  podcast  catch up  timeline of events,-0.1027,neutral,0,0
Pentagon officially releases UFO videos,http://rss.cnn.com/~r/rss/cnn_topstories/~3/EsQAWfI6X9Q/index.html,"The Pentagon has officially released three short videos showing ""unidentified aerial phenomena"" that had previously been released by a private company.",2020-04-27 17:06:20+00:00,rss/cnn_topstories,pentagon officially releases ufo videos the pentagon has officially released three short videos showing unidentified aerial phenomena that had previously been released by a private company,0.0,neutral,0,0
Man who delivers handmade crosses to mass shootings has weeks to live,http://rss.cnn.com/~r/rss/cnn_topstories/~3/bO4_HwlEiUQ/index.html,"Greg Zanis, the Illinois man who for years has brought crosses and other remembrances to sites of mass shootings and other disasters, will soon need a cross of his own.",2020-04-27 17:42:41+00:00,rss/cnn_topstories,man who delivers handmade crosses to mass shootings has weeks to live greg zanis the illinois man who for years has brought crosses and other remembrances to sites of mass shootings and other disasters will soon need a cross of his own,-0.5574,negative,0,0
Coroner: People without masks playing 'Russian roulette' with life,http://rss.cnn.com/~r/rss/cnn_topstories/~3/s2ma1kFu_JM/ga-coroner-michael-fowler-people-without-masks-newsroom-vpx.cnn,"Georgia coroner Michael Fowler pleads with residents to stay home, warning that people going outside without masks could die from contracting coronavirus.",2020-04-27 15:21:39+00:00,rss/cnn_topstories,coroner people without masks playing russian roulette with life georgia coroner michael fowler pleads with residents to stay home warning that people going outside without masks could die from contracting coronavirus,0.0397,neutral,0,0
Patriots rookie says he will cover tattoo,http://rss.cnn.com/~r/rss/cnn_topstories/~3/eK6E0Nivb7Y/index.html,New England Patriots rookie kicker Justin Rohrwasser said Saturday he will cover up a controversial tattoo he got as a teenager.,2020-04-26 19:03:12+00:00,rss/cnn_topstories,patriots rookie says he will cover tattoo new england patriots rookie kicker justin rohrwasser said saturday he will cover up a controversial tattoo he got as a teenager,-0.2023,negative,0,0
What it could take to get schools back open,http://rss.cnn.com/~r/rss/cnn_topstories/~3/OLspAghyK40/index.html,"Frazzled parents, anxious teachers and many children are already looking forward to the day when schools will reopen but it's not an easy road.",2020-04-27 17:46:39+00:00,rss/cnn_topstories,what it could take to get schools back open frazzled parents anxious teachers and many children are already looking forward to the day when schools will reopen but its not an easy road,-0.5587,negative,0,0
Michelle Obama says 'Becoming' documentary coming to Netflix next month,http://rss.cnn.com/~r/rss/cnn_topstories/~3/PeuSIgdElQ4/index.html,"Michelle Obama has announced the release of a documentary film based on experiences she encountered after writing her memoir, ""Becoming.""",2020-04-27 17:46:19+00:00,rss/cnn_topstories,michelle obama says becoming documentary coming to netflix next month michelle obama has announced the release of a documentary film based on experiences she encountered after writing her memoir becoming,0.0,neutral,0,0
Glitches hamper second round of small business loan funding,http://rss.cnn.com/~r/rss/cnn_topstories/~3/zFIcXtSABTU/index.html,"The race is on for small business owners across the country to access billions in emergency funding Monday through the Small Business Administration. And, in a few hours, the Paycheck Protection Program -- initially plagued by technical hiccups and questions about if lenders were prioritizing the businesses that needed the money most -- will get a second chance to get things right.",2020-04-27 18:00:12+00:00,rss/cnn_topstories,glitches hamper second round of small business loan funding the race is on for small business owners across the country to access billions in emergency funding monday through the small business administration and in a few hours the paycheck protection program  initially plagued by technical hiccups and questions about if lenders were prioritizing the businesses that needed the money most  will get a second chance to get things right,-0.1531,neutral,0,0
North Korean media publishes letter from Kim Jong Un dated April 27,http://rss.cnn.com/~r/rss/cnn_topstories/~3/y0UMZtHHYXc/index.html,North Korean state media on Monday published a letter from the country's leader Kim Jong Un to South African President Cyril Ramaphosa congratulating him on Freedom Day.,2020-04-27 15:22:57+00:00,rss/cnn_topstories,north korean media publishes letter from kim jong un dated april 27 north korean state media on monday published a letter from the countrys leader kim jong un to south african president cyril ramaphosa congratulating him on freedom day,0.6369,positive,0,0
Images show Kim Jong Un's compound,http://rss.cnn.com/~r/rss/cnn_topstories/~3/yica9WrpAKw/kim-jong-un-satellite-image-ripley-newday-vpx.cnn,"Newly released satellite images show Kim Jong Un's compound in Wonsan, North Korea, as questions circulate about the state of the North Korean leader's health. CNN's Will Ripley reports.",2020-04-26 14:24:10+00:00,rss/cnn_topstories,images show kim jong uns compound newly released satellite images show kim jong uns compound in wonsan north korea as questions circulate about the state of the north korean leaders health cnns will ripley reports,0.0,neutral,0,0
"It's wrong to use two spaces between sentences, Microsoft Word says",http://rss.cnn.com/~r/rss/cnn_topstories/~3/23zEf1MxGmk/index.html,Microsoft has made its typographical decree: Two spaces between sentences is too many.,2020-04-27 13:11:59+00:00,rss/cnn_topstories,its wrong to use two spaces between sentences microsoft word says microsoft has made its typographical decree two spaces between sentences is too many,-0.4019,negative,0,0
Miley Cyrus gave a haunting 'SNL' performance,http://rss.cnn.com/~r/rss/cnn_topstories/~3/Ol1yDetGy74/index.html,"Miley Cyrus, please give us an acoustic album.",2020-04-27 17:11:22+00:00,rss/cnn_topstories,miley cyrus gave a haunting snl performance miley cyrus please give us an acoustic album,0.0516,neutral,0,0
'American Idol' contestants get creative performing from home,http://rss.cnn.com/~r/rss/cnn_topstories/~3/YZ8u-4_UlQ4/american-idol-contestants-home-performances-meade-knowles-hln-vpx.hln,"""American Idol"" contestants and judges continue with the singing competition from their homes. HLN's Melissa Knowles has more.",2020-04-27 13:06:23+00:00,rss/cnn_topstories,american idol contestants get creative performing from home american idol contestants and judges continue with the singing competition from their homes hlns melissa knowles has more,0.4404,positive,0,0
'Duck Dynasty' star drive-by shooting results in man's arrest,http://rss.cnn.com/~r/rss/cnn_topstories/~3/Qx1gjNIngtk/index.html,"Louisiana authorities have arrested a man following a drive-by shooting at the estate of ""Duck Dynasty"" star Willie Robertson.",2020-04-27 16:54:14+00:00,rss/cnn_topstories,duck dynasty star driveby shooting results in mans arrest louisiana authorities have arrested a man following a driveby shooting at the estate of duck dynasty star willie robertson,-0.6705,negative,0,0
'Parks and Recreation' co-creator growing beard for charity,http://rss.cnn.com/~r/rss/cnn_topstories/~3/jTqXkZdg55M/michael-schur-los-angeles-food-bank-newday-vpx.cnn,"""Parks and Recreation"" co-creator Michael Schur is growing out his beard to imitate the character Mose, who he played on the television show ""The Office,"" after promising his Twitter followers that he would to raise money for the Los Angeles Regional Food Bank.",2020-04-27 13:49:40+00:00,rss/cnn_topstories,parks and recreation cocreator growing beard for charity parks and recreation cocreator michael schur is growing out his beard to imitate the character mose who he played on the television show the office after promising his twitter followers that he would to raise money for the los angeles regional food bank,0.8519,positive,0,0
Kristin Cavallari and Jay Cutler are divorcing,http://rss.cnn.com/~r/rss/cnn_topstories/~3/NatlEZjsTic/index.html,Kristin Cavallari and Jay Cutler are getting a divorce.,2020-04-27 13:57:40+00:00,rss/cnn_topstories,kristin cavallari and jay cutler are divorcing kristin cavallari and jay cutler are getting a divorce,0.0,neutral,0,0
Watch Brad Pitt channel Dr. Fauci on 'SNL',http://rss.cnn.com/~r/rss/cnn_topstories/~3/zAzceY5TwXs/saturday-night-live-home-brad-pitt-dr-fauci.cnn,"In a surprise appearance, Brad Pitt played Dr. Anthony Fauci in the opening of Saturday's ""SNL,"" which was produced remotely because of the coronavirus pandemic.",2020-04-26 06:56:13+00:00,rss/cnn_topstories,watch brad pitt channel dr fauci on snl in a surprise appearance brad pitt played dr anthony fauci in the opening of saturdays snl which was produced remotely because of the coronavirus pandemic,0.5423,positive,0,0
Hospitals are studying a common heartburn drug as Covid-19 treatment,http://rss.cnn.com/~r/rss/cnn_topstories/~3/b4_AkaIVWe4/index.html,"Hospitals in New York are giving Covid-19 patients heartburn medicine to see if it helps fight the virus, according to the doctor who initiated the trial.",2020-04-27 10:50:43+00:00,rss/cnn_topstories,hospitals are studying a common heartburn drug as covid19 treatment hospitals in new york are giving covid19 patients heartburn medicine to see if it helps fight the virus according to the doctor who initiated the trial,0.34,positive,0,0
DJ Jazzy Jeff describes his experience with coronavirus,http://rss.cnn.com/~r/rss/cnn_topstories/~3/k23DCe7-yU4/dj-jazzy-jeff-coronavirus-experience-elam-pkg-vpx.cnn,"Grammy-winner DJ Jazzy Jeff says he's suffering from COVID-19, and that he believes he contracted the virus while in Idaho.",2020-04-26 20:56:34+00:00,rss/cnn_topstories,dj jazzy jeff describes his experience with coronavirus grammywinner dj jazzy jeff says hes suffering from covid19 and that he believes he contracted the virus while in idaho,-0.4767,negative,0,0
People crowd US beaches despite coronavirus concerns,http://rss.cnn.com/~r/rss/cnn_topstories/~3/XuD_nZo3N0c/index.html,"Seeking relief from a heat wave, thousands of people crowded beaches in Southern California this weekend amid the coronavirus pandemic, despite a statewide stay-at-home order implemented by the governor last month.",2020-04-27 05:36:45+00:00,rss/cnn_topstories,people crowd us beaches despite coronavirus concerns seeking relief from a heat wave thousands of people crowded beaches in southern california this weekend amid the coronavirus pandemic despite a statewide stayathome order implemented by the governor last month,0.4767,positive,0,0
Why some kids are happier right now,http://rss.cnn.com/~r/rss/cnn_topstories/~3/_U9VT2KaIOk/index.html,"Like most parents, Seagal Hagege, a mom of three in Irvine, California, wasn't exactly looking forward to sheltering in place.",2020-04-27 08:56:42+00:00,rss/cnn_topstories,why some kids are happier right now like most parents seagal hagege a mom of three in irvine california wasnt exactly looking forward to sheltering in place,0.7096,positive,0,0
Meryl Streep and friends boozing and singing in their bathrobes is the moment the world needed,http://rss.cnn.com/~r/rss/cnn_topstories/~3/BgiTyb83xjQ/index.html,"Meryl Streep, Audra McDonald and Christine Baranski, boozing in their bathrobes while singing ""The Ladies Who Lunch."" This was the quarantine moment the world didn't know it needed -- until now.",2020-04-27 10:37:58+00:00,rss/cnn_topstories,meryl streep and friends boozing and singing in their bathrobes is the moment the world needed meryl streep audra mcdonald and christine baranski boozing in their bathrobes while singing the ladies who lunch this was the quarantine moment the world didnt know it needed  until now,0.4767,positive,0,0
"Contrasting images, miles apart, as some California beaches reopen",http://rss.cnn.com/~r/rss/cnn_topstories/~3/XzCC8moWdwA/california-beaches-reopen-paul-vercammen-vpx.cnn,Relaxed restrictions and a record heat wave are sending crowds to some beaches in California amid the coronavirus pandemic.,2020-04-26 18:45:08+00:00,rss/cnn_topstories,contrasting images miles apart as some california beaches reopen relaxed restrictions and a record heat wave are sending crowds to some beaches in california amid the coronavirus pandemic,0.4939,positive,0,0
Coronavirus forced a group of teens to sail home across the Atlantic,http://rss.cnn.com/~r/rss/cnn_topstories/~3/c_-Z8w6PJ6I/index.html,"As journeys home go, it was a particularly long and unusual one.",2020-04-27 15:42:56+00:00,rss/cnn_topstories,coronavirus forced a group of teens to sail home across the atlantic as journeys home go it was a particularly long and unusual one,-0.4588,negative,0,0
Apple's $399 iPhone SE is officially here,http://rss.cnn.com/~r/rss/cnn_topstories/~3/dfxrvhPb4wc/index.html,,no date,rss/cnn_topstories,apples 399 iphone se is officially here ,0.0,neutral,0,0
We tested the best nonstick pans of 2020,http://rss.cnn.com/~r/rss/cnn_topstories/~3/Wt58w6QUfus/index.html,,no date,rss/cnn_topstories,we tested the best nonstick pans of 2020 ,0.6369,positive,0,0
Shop Nordstrom's one-day deals on Mother's Day gifts,http://rss.cnn.com/~r/rss/cnn_topstories/~3/W0ZGUPyPHug/index.html,,no date,rss/cnn_topstories,shop nordstroms oneday deals on mothers day gifts ,0.0,neutral,0,0
Get personal with customizable Mother's Day gifts,http://rss.cnn.com/~r/rss/cnn_topstories/~3/5qA7KxWzLzo/index.html,,no date,rss/cnn_topstories,get personal with customizable mothers day gifts ,0.0,neutral,0,0
What happened when I bought a hotel by mistake,http://rss.cnn.com/~r/rss/cnn_topstories/~3/uitfPetO32I/index.html,"Anyone currently whiling away the long hours of lockdown with when-this-is-all-over dreams of a fresh start in life, should heed this as a cautionary tale.",2020-04-27 07:39:23+00:00,rss/cnn_topstories,what happened when i bought a hotel by mistake anyone currently whiling away the long hours of lockdown with whenthisisallover dreams of a fresh start in life should heed this as a cautionary tale,0.3818,positive,0,0
Watch glow-in-the-dark dolphins glide through the ocean,http://rss.cnn.com/~r/rss/cnn_topstories/~3/puRMuNxKkrM/bioluminescent-dolphins-newport-beach-orig-vstan-bdk.cnn,A photographer captured video of dolphins glowing as they glide through bioluminescent ocean water at night.,2020-04-27 17:53:36+00:00,rss/cnn_topstories,watch glowinthedark dolphins glide through the ocean a photographer captured video of dolphins glowing as they glide through bioluminescent ocean water at night,0.0,neutral,0,0
What flying economy class could look like after the virus,http://rss.cnn.com/~r/rss/cnn_topstories/~3/mBbDVfyrgHk/index.html,"It's clear flying will be different after coronavirus, and while some airlines are discussing the removal of middle seats to maintain social distancing, one airplane interiors company has come up with concepts for adapting economy class cabins.",2020-04-24 10:51:14+00:00,rss/cnn_topstories,what flying economy class could look like after the virus its clear flying will be different after coronavirus and while some airlines are discussing the removal of middle seats to maintain social distancing one airplane interiors company has come up with concepts for adapting economy class cabins,0.6249,positive,0,0
The new budget iPhone SE is the right phone for an uncertain time,http://rss.cnn.com/~r/rss/cnn_topstories/~3/Kph1uTOyS8Q/index.html,"In a normal year, the process of reviewing a new iPhone might start with a flashy press event followed some days later by a carefully-staged unboxing while a professional camera rolls on a perfectly composed reviewer.",2020-04-25 12:28:46+00:00,rss/cnn_topstories,the new budget iphone se is the right phone for an uncertain time in a normal year the process of reviewing a new iphone might start with a flashy press event followed some days later by a carefullystaged unboxing while a professional camera rolls on a perfectly composed reviewer,0.4588,positive,0,0
The world's biggest car factory just reopened. Here's what Volkswagen had to do,http://rss.cnn.com/~r/rss/cnn_topstories/~3/crVGsEUnLtk/index.html,Volkswagen reopened the world's biggest car factory at Wolfsburg in Germany on Monday after the coronavirus forced it to shut down for the longest period in its 82-year history.,2020-04-27 13:47:52+00:00,rss/cnn_topstories,the worlds biggest car factory just reopened heres what volkswagen had to do volkswagen reopened the worlds biggest car factory at wolfsburg in germany on monday after the coronavirus forced it to shut down for the longest period in its 82year history,-0.4588,negative,0,0
Here's how journalists should handle Trump,http://rss.cnn.com/~r/rss/cnn_topstories/~3/JcilUohcyJI/index.html,"After Thursday's disinfectant fiasco some are speculating we've seen the last of the freewheeling White House press briefings. But given what we've seen over the last three years, I expect President Donald Trump will be back, and he'll be back soon, as staying out of the limelight is just not in his nature. To prepare for that, here's some advice for reporters to make these briefings more productive and informative.",2020-04-26 22:10:36+00:00,rss/cnn_topstories,heres how journalists should handle trump after thursdays disinfectant fiasco some are speculating weve seen the last of the freewheeling white house press briefings but given what weve seen over the last three years i expect president donald trump will be back and hell be back soon as staying out of the limelight is just not in his nature to prepare for that heres some advice for reporters to make these briefings more productive and informative,-0.8519,negative,1,0
Dr. Birx is struggling with a nearly impossible choice,http://rss.cnn.com/~r/rss/cnn_topstories/~3/Iv7OkpkJagQ/index.html,Life in a pandemic is filled with ethical and moral dilemmas for everyone. We have to weigh the cost to ourselves and others of decisions that barely merited a second thought in pre-pandemic life. But few people have had to wrestle with their conscience in full view of the world the way the government's top scientists do these days.,2020-04-27 07:24:24+00:00,rss/cnn_topstories,dr birx is struggling with a nearly impossible choice life in a pandemic is filled with ethical and moral dilemmas for everyone we have to weigh the cost to ourselves and others of decisions that barely merited a second thought in prepandemic life but few people have had to wrestle with their conscience in full view of the world the way the governments top scientists do these days,0.4595,positive,0,0
Dangerous collisions in Trumpland,http://rss.cnn.com/~r/rss/cnn_topstories/~3/nFfuct-3Gvs/index.html,"After 50,000 Covid-19 deaths, enormous job losses and and more than a month under lockdown, stunned Americans are looking for signs of hope. And President Donald Trump has been trying to provide them.",2020-04-26 17:56:54+00:00,rss/cnn_topstories,dangerous collisions in trumpland after 50000 covid19 deaths enormous job losses and and more than a month under lockdown stunned americans are looking for signs of hope and president donald trump has been trying to provide them,-0.6597,negative,1,0
"At West Point, is Trump speaking worth the risk?",http://rss.cnn.com/~r/rss/cnn_topstories/~3/iEW88tFwlr8/index.html,"As a graduate of West Point, I never thought I would write this, but the leadership at the US Naval Academy got it right. After telling the midshipmen to ""stay at home"" after spring break on April 10 and conducting distance learning classes since, Navy's Superintendent Vice Adm. Sean Buck canceled the Annapolis graduation and commissioning week to ""safeguard the health and welfare of the entire Naval Academy family."" Buck and Commandant of Midshipman Capt. T.R. Buchanan then approved a ""virtual ceremony.""",2020-04-27 12:34:09+00:00,rss/cnn_topstories,at west point is trump speaking worth the risk as a graduate of west point i never thought i would write this but the leadership at the us naval academy got it right after telling the midshipmen to stay at home after spring break on april 10 and conducting distance learning classes since navys superintendent vice adm sean buck canceled the annapolis graduation and commissioning week to safeguard the health and welfare of the entire naval academy family buck and commandant of midshipman capt tr buchanan then approved a virtual ceremony,0.7906,positive,1,0
