title,link,summary,date,source,cleaned,sentiment#,sentiment,trump,biden
The White House senior adviser contradicts Gretchen Whitmer's assertion that Michigan is struggling to obtain supplies needed to conduct coronavirus tests,http://rss.cnn.com/~r/rss/cnn_topstories/~3/8QQHrWhp3rI/index.html,Podcast | Timeline | Catch up | All 50 states' reopening plans,2020-05-03 19:49:16+00:00,rss/cnn_topstories,the white house senior adviser contradicts gretchen whitmers assertion that michigan is struggling to obtain supplies needed to conduct coronavirus tests podcast  timeline  catch up  all 50 states reopening plans,-0.6369,negative,0,0
"244,000 deaths have been recorded globally",http://rss.cnn.com/~r/rss/cnn_topstories/~3/84-LXIXm21k/,,no date,rss/cnn_topstories,244000 deaths have been recorded globally ,0.0,neutral,0,0
City drops mask rule after workers are threatened,http://rss.cnn.com/~r/rss/cnn_topstories/~3/Cw6Erw1n8x8/index.html,Podcast | Timeline | Catch up | States' reopening plans,2020-05-03 12:25:55+00:00,rss/cnn_topstories,city drops mask rule after workers are threatened podcast  timeline  catch up  states reopening plans,-0.4588,negative,0,0
King breaks down which states meet guidelines for reopening,http://rss.cnn.com/~r/rss/cnn_topstories/~3/-IXMc2JVtkE/states-reopening-john-king-magic-wall-ip-vpx.cnn,CNN's John King takes a look at how all 50 states are addressing reopening amid the coronavirus pandemic.,2020-05-03 16:35:39+00:00,rss/cnn_topstories,king breaks down which states meet guidelines for reopening cnns john king takes a look at how all 50 states are addressing reopening amid the coronavirus pandemic,0.0,neutral,0,0
See where your state stands on flattening the curve,http://rss.cnn.com/~r/rss/cnn_topstories/~3/7j-wYoq2Lkw/index.html,,no date,rss/cnn_topstories,see where your state stands on flattening the curve ,0.0,neutral,0,0
Brian Stelter: Leaders are failing to tell the hard truth,http://rss.cnn.com/~r/rss/cnn_topstories/~3/6ZTY6VhC0Rs/stelter-covid-19-coronavirus-opening-hard-truths-rs-vpx.cnn,CNN's Brian Stelter breaks down the hard truths some leaders are refusing to talk about with the public.,2020-05-03 15:41:54+00:00,rss/cnn_topstories,brian stelter leaders are failing to tell the hard truth cnns brian stelter breaks down the hard truths some leaders are refusing to talk about with the public,-0.4019,negative,0,0
Birx: Michigan protests were 'devastatingly worrisome',http://rss.cnn.com/~r/rss/cnn_topstories/~3/KkxGvdQB7Nk/index.html,"Dr. Deborah Birx, a White House coronavirus task force official, said that the protests last week in the Michigan state legislature were ""devastatingly worrisome to me personally.""",2020-05-03 15:29:40+00:00,rss/cnn_topstories,birx michigan protests were devastatingly worrisome dr deborah birx a white house coronavirus task force official said that the protests last week in the michigan state legislature were devastatingly worrisome to me personally,-0.9325,negative,0,0
How Trump has broken the polls,http://rss.cnn.com/~r/rss/cnn_topstories/~3/iOAfQT_MQYI/index.html,Poll of the week: A new Ipsos/Reuters poll finds that former Vice President Joe Biden leads President Donald Trump by a 45% to 39% margin.,2020-05-03 19:39:16+00:00,rss/cnn_topstories,how trump has broken the polls poll of the week a new ipsosreuters poll finds that former vice president joe biden leads president donald trump by a 45 to 39 margin,-0.4767,negative,1,1
Opinion: Donald Trump turns the switch,http://rss.cnn.com/~r/rss/cnn_topstories/~3/psuSa11wCfQ/index.html,Gone were the daily White House briefings with Vice President Mike Pence solemnly urging Americans to shelter at home to stop the spread of Covid-19 and governors to follow a slowly phased-in reopening plan. The 45 days of federally recommended social distancing ended Thursday. Now the Trump administration was all-in on reopening America.,2020-05-03 14:01:31+00:00,rss/cnn_topstories,opinion donald trump turns the switch gone were the daily white house briefings with vice president mike pence solemnly urging americans to shelter at home to stop the spread of covid19 and governors to follow a slowly phasedin reopening plan the 45 days of federally recommended social distancing ended thursday now the trump administration was allin on reopening america,0.1027,neutral,1,0
DeSantis is ready to declare victory but the coronavirus picture in Florida is still unclear,http://rss.cnn.com/~r/rss/cnn_topstories/~3/HWPwkVoTaXQ/index.html,Epidemiologists are still baffled by how the coronavirus pandemic has played out thus far in Florida but the state's governor isn't waiting much longer to declare his response a win.,2020-05-03 16:13:03+00:00,rss/cnn_topstories,desantis is ready to declare victory but the coronavirus picture in florida is still unclear epidemiologists are still baffled by how the coronavirus pandemic has played out thus far in florida but the states governor isnt waiting much longer to declare his response a win,0.8201,positive,0,0
Trump moves to replace official who issued Covid-19 report,http://rss.cnn.com/~r/rss/cnn_topstories/~3/l181T_MjbD8/trump-hhs-christi-grimm-tapper-sotu-vpx.cnn,President Trump has made moves to replace the acting inspector general at the Department of Health and Human Services after the office issued a report about Covid-19.,2020-05-03 14:32:50+00:00,rss/cnn_topstories,trump moves to replace official who issued covid19 report president trump has made moves to replace the acting inspector general at the department of health and human services after the office issued a report about covid19,0.0,neutral,1,0
George W. Bush calls for an end to partisanship in fight against coronavirus,http://rss.cnn.com/~r/rss/cnn_topstories/~3/KMmuXabakXg/index.html,"Former President George W. Bush called for an end to partisanship in the nation's continued battle against the coronavirus, urging Americans to ""remember that empathy and simple kindness are essential powerful tools of national recovery.""",2020-05-03 18:43:21+00:00,rss/cnn_topstories,george w bush calls for an end to partisanship in fight against coronavirus former president george w bush called for an end to partisanship in the nations continued battle against the coronavirus urging americans to remember that empathy and simple kindness are essential powerful tools of national recovery,0.1531,neutral,0,0
Tapper presses Kudlow: Why not take action now?,http://rss.cnn.com/~r/rss/cnn_topstories/~3/1De1XEwlb5Y/larry-kudlow-economy-stimulus-money-sotu-vpx.cnn,CNN's Jake Tapper speaks with White House economic adviser Larry Kudlow about stimulus relief funds for Americans during the coronavirus pandemic.,2020-05-03 14:07:15+00:00,rss/cnn_topstories,tapper presses kudlow why not take action now cnns jake tapper speaks with white house economic adviser larry kudlow about stimulus relief funds for americans during the coronavirus pandemic,0.4767,positive,0,0
"Trump nominee, once a SCOTUS clerk, unhappy how Obamacare ruling played out",http://rss.cnn.com/~r/rss/cnn_topstories/~3/dKZZ7rJ8_Lo/index.html,"Judge Justin Walker, now nominated to a powerful federal court dubbed ""the second highest"" in the nation, remains bitter that the Supreme Court upheld the Affordable Care Act eight years ago.",2020-05-03 16:00:35+00:00,rss/cnn_topstories,trump nominee once a scotus clerk unhappy how obamacare ruling played out judge justin walker now nominated to a powerful federal court dubbed the second highest in the nation remains bitter that the supreme court upheld the affordable care act eight years ago,0.7506,positive,1,0
"Opinion: While Bush pleads for unity, Trump plays coronavirus victim",http://rss.cnn.com/~r/rss/cnn_topstories/~3/MVpRpOZXUNI/index.html,"On Saturday, former President George W. Bush released a short, heartfelt video offering words of support for a nation rocked by a staggering loss of lives and livelihoods during the coronavirus pandemic. In less than three minutes, a somber-voiced Bush expressed gratitude to the nation's medical professionals, called on Americans to protect their neighbors by keeping their distance from them and urged us to show empathy and kindness to all. ""Let us remember how small our differences are in the face of this shared threat,"" he said. ""We are not partisan combatants. We are human beings, equally vulnerable and equally wonderful in the sight of God.""",2020-05-03 19:15:02+00:00,rss/cnn_topstories,opinion while bush pleads for unity trump plays coronavirus victim on saturday former president george w bush released a short heartfelt video offering words of support for a nation rocked by a staggering loss of lives and livelihoods during the coronavirus pandemic in less than three minutes a sombervoiced bush expressed gratitude to the nations medical professionals called on americans to protect their neighbors by keeping their distance from them and urged us to show empathy and kindness to all let us remember how small our differences are in the face of this shared threat he said we are not partisan combatants we are human beings equally vulnerable and equally wonderful in the sight of god,0.9505,positive,1,0
CNN follows contact tracers as they try to contain Covid-19,http://rss.cnn.com/~r/rss/cnn_topstories/~3/kKewn7hEYk4/coronavirus-contact-tracing-turkey-arwa-damon-pkg-vpx.cnn,CNN's Arwa Damon follows a group of contact tracers as they try to track down and contain exposure to coronavirus in Turkey.,2020-05-03 17:14:16+00:00,rss/cnn_topstories,cnn follows contact tracers as they try to contain covid19 cnns arwa damon follows a group of contact tracers as they try to track down and contain exposure to coronavirus in turkey,0.0,neutral,0,0
A weekend marked by park days and protests,http://rss.cnn.com/~r/rss/cnn_topstories/~3/Yef8LP5L-kI/index.html,,2020-05-03 19:13:32+00:00,rss/cnn_topstories,a weekend marked by park days and protests ,-0.2263,negative,0,0
What happens if a vaccine is never developed?,http://rss.cnn.com/~r/rss/cnn_topstories/~3/Jy2Aa_9Ti54/index.html,Podcast | Timeline | Catch up | All 50 states' reopening plans,2020-05-03 16:59:24+00:00,rss/cnn_topstories,what happens if a vaccine is never developed podcast  timeline  catch up  all 50 states reopening plans,0.0,neutral,0,0
"Matt Keough, former Oakland Athletics pitcher and 'Real Housewives' figure, dies",http://rss.cnn.com/~r/rss/cnn_topstories/~3/CBkZVLJr4yo/index.html,"Matt Keough, a former major league pitcher and an occasional figure on ""Real Housewives of Orange County,"" died Friday at the age of 64. The cause was not made public.",2020-05-03 14:49:18+00:00,rss/cnn_topstories,matt keough former oakland athletics pitcher and real housewives figure dies matt keough a former major league pitcher and an occasional figure on real housewives of orange county died friday at the age of 64 the cause was not made public,-0.5574,negative,0,0
"Women dressed as nurses are stealing packages off porches, police say",http://rss.cnn.com/~r/rss/cnn_topstories/~3/gGwJAEFaPdM/index.html,"Women dressed as health care workers are taking packages from outside residents homes in Washington state, according to the Kennewick Police Department.",2020-05-03 17:16:58+00:00,rss/cnn_topstories,women dressed as nurses are stealing packages off porches police say women dressed as health care workers are taking packages from outside residents homes in washington state according to the kennewick police department,-0.128,neutral,0,0
Trump blames China for outbreak. See how they responded.,http://rss.cnn.com/~r/rss/cnn_topstories/~3/GclmFMaHEvk/chinese-media-coronavirus-reaction-rivers-pkg-tsr-vpx.cnn,CNN's Matt Rivers reports on how Chinese state media is responding to blame from the US for their coronavirus response.,2020-05-01 22:46:44+00:00,rss/cnn_topstories,trump blames china for outbreak see how they responded cnns matt rivers reports on how chinese state media is responding to blame from the us for their coronavirus response,-0.6249,negative,1,0
"This Texas teen delivered 10,000 masks to medical workers. She's also fighting a stigma",http://rss.cnn.com/~r/rss/cnn_topstories/~3/rTZk54UzXx4/index.html,"Most ninth-grade girls worry about schoolwork, friends and crushes. Lately, however, Valerie Xu has focused on face masks.",2020-05-03 18:47:14+00:00,rss/cnn_topstories,this texas teen delivered 10000 masks to medical workers shes also fighting a stigma most ninthgrade girls worry about schoolwork friends and crushes lately however valerie xu has focused on face masks,-0.4336,negative,0,0
Pompeo says initial reports show shots fired from North Korea were 'accidental',http://rss.cnn.com/~r/rss/cnn_topstories/~3/1IIfQVjx9yY/index.html,"Secretary of State Mike Pompeo says the initial reports on the shots fired from North Korea into South Korea on Sunday morning indicate they were ""accidental.""",2020-05-03 16:40:39+00:00,rss/cnn_topstories,pompeo says initial reports show shots fired from north korea were accidental secretary of state mike pompeo says the initial reports on the shots fired from north korea into south korea on sunday morning indicate they were accidental,-0.8316,negative,0,0
Analysis: Here's how Italians 'quaranteamed' 700 years ago,http://rss.cnn.com/~r/rss/cnn_topstories/~3/a1Zvzrl3hxw/index.html,"How was social distance observed (if at all) during previous pandemics? Turns out there's quite a precedent not just for staying away for your neighbors, but also for the idea of ""quaranteaming"" you might have heard about.",2020-05-03 12:01:04+00:00,rss/cnn_topstories,analysis heres how italians quaranteamed 700 years ago how was social distance observed if at all during previous pandemics turns out theres quite a precedent not just for staying away for your neighbors but also for the idea of quaranteaming you might have heard about,0.0,neutral,0,0
Ex-Bush official says lockdown protesters aren't heroes,http://rss.cnn.com/~r/rss/cnn_topstories/~3/EVLc59uZDP8/tom-ridge-lockdown-protest-not-heroes-sot-tsr-vpx.cnn,"Former Republican Governor of Pennsylvania Tom Ridge, who also served as the Homeland Security secretary under President George W. Bush, says armed protesters demonstrating against coronavirus lockdown orders are self-absorbed and not heroes.",2020-05-03 01:14:22+00:00,rss/cnn_topstories,exbush official says lockdown protesters arent heroes former republican governor of pennsylvania tom ridge who also served as the homeland security secretary under president george w bush says armed protesters demonstrating against coronavirus lockdown orders are selfabsorbed and not heroes,-0.7007,negative,0,0
Biden confronts allegation as he prepares for unprecedented campaign against Trump,http://rss.cnn.com/~r/rss/cnn_topstories/~3/ftz0K5Pbxik/index.html,"Six months before Election Day, Joe Biden is scrambling to build a campaign to wage a political fight with little precedent in American history, hoping to capitalize on opportunities and overcome challenges that the coronavirus crisis has injected into his battle with President Donald Trump.",2020-05-03 20:03:24+00:00,rss/cnn_topstories,biden confronts allegation as he prepares for unprecedented campaign against trump six months before election day joe biden is scrambling to build a campaign to wage a political fight with little precedent in american history hoping to capitalize on opportunities and overcome challenges that the coronavirus crisis has injected into his battle with president donald trump,-0.6705,negative,1,1
Tens of thousands of flamingos flock to a locked-down Mumbai,http://rss.cnn.com/~r/rss/cnn_topstories/~3/LF2AAO1S1V0/index.html,"The humans may be in lockdown in India, but tens of thousands of flamingos are making the most of the peace and quiet.",2020-05-01 17:11:57+00:00,rss/cnn_topstories,tens of thousands of flamingos flock to a lockeddown mumbai the humans may be in lockdown in india but tens of thousands of flamingos are making the most of the peace and quiet,0.7307,positive,0,0
"A woman in South Carolina is dead after an 'alligator encounter,' authorities say",http://rss.cnn.com/~r/rss/cnn_topstories/~3/1eEhJ5LTfhY/index.html,"A woman is dead after a run-in with an alligator on a South Carolina island, the Charleston County Sheriff's Office said.",2020-05-03 17:55:57+00:00,rss/cnn_topstories,a woman in south carolina is dead after an alligator encounter authorities say a woman is dead after a runin with an alligator on a south carolina island the charleston county sheriffs office said,-0.8625,negative,0,0
The world is paying a high price for cheap clothes,http://rss.cnn.com/~r/rss/cnn_topstories/~3/23i9-kJTrZQ/index.html,,2020-05-03 07:32:13+00:00,rss/cnn_topstories,the world is paying a high price for cheap clothes ,0.0,neutral,0,0
'Game of Thrones' star sets deadlift record,http://rss.cnn.com/~r/rss/cnn_topstories/~3/ela-_JqH8Bw/index.html,"Hafþór Björnsson, best known for playing the Mountain in the popular HBO series ""Game of Thrones,"" just broke a major world record.",2020-05-03 15:12:46+00:00,rss/cnn_topstories,game of thrones star sets deadlift record hafr bjrnsson best known for playing the mountain in the popular hbo series game of thrones just broke a major world record,0.7184,positive,0,0
Secretariat wins virtual Triple Crown at Kentucky Derby,http://rss.cnn.com/~r/rss/cnn_topstories/~3/kvcjDPviP9g/kentucky-derby-virtual-triple-crown-orig-kj.cnn,A virtual horse race featuring the past 13 Triple Crown winners was held to raise money for Covid-19 relief after the 146th Kentucky Derby was postponed due to the pandemic.,2020-05-03 13:45:35+00:00,rss/cnn_topstories,secretariat wins virtual triple crown at kentucky derby a virtual horse race featuring the past 13 triple crown winners was held to raise money for covid19 relief after the 146th kentucky derby was postponed due to the pandemic,0.8442,positive,0,0
'Scrubs' actor Sam Lloyd dies at 56,http://rss.cnn.com/~r/rss/cnn_topstories/~3/Gey0Pr3oZ-k/index.html,"Actor Sam Lloyd, who appeared on several television shows and portrayed lawyer Ted Buckland on the comedy, ""Scrubs,"" has died, his agent said.",2020-05-02 05:33:28+00:00,rss/cnn_topstories,scrubs actor sam lloyd dies at 56 actor sam lloyd who appeared on several television shows and portrayed lawyer ted buckland on the comedy scrubs has died his agent said,-0.2732,negative,0,0
Actress got caught using restroom on 'Zoom' call,http://rss.cnn.com/~r/rss/cnn_topstories/~3/oVWyDgzzK0A/tiffany-haddish-embarassing-zoom-call-vpx.hln,"Tiffany Haddish recounts taking a bathroom break in the middle of a ""Zoom"" meeting, and not realizing that she could be seen by other callers in the meeting.",2020-04-30 12:09:41+00:00,rss/cnn_topstories,actress got caught using restroom on zoom call tiffany haddish recounts taking a bathroom break in the middle of a zoom meeting and not realizing that she could be seen by other callers in the meeting,0.0,neutral,0,0
"The human needs driving the rise in gardening, and how to start one",http://rss.cnn.com/~r/rss/cnn_topstories/~3/rQSKM-Vh8M8/index.html,Local plant nurseries are seeing spikes in seed sales.,2020-05-03 14:51:43+00:00,rss/cnn_topstories,the human needs driving the rise in gardening and how to start one local plant nurseries are seeing spikes in seed sales,0.0,neutral,0,0
Italy's incredible 'floating ship' bridge reaches for the sky,http://rss.cnn.com/~r/rss/cnn_topstories/~3/qlQgyoDBNko/index.html,"High above the Polcevera valley, the final section of a majestic new bridge was hoisted into place this week, signaling the imminent completion of a remarkable engineering project against seemingly impossible odds.",2020-05-03 09:22:35+00:00,rss/cnn_topstories,italys incredible floating ship bridge reaches for the sky high above the polcevera valley the final section of a majestic new bridge was hoisted into place this week signaling the imminent completion of a remarkable engineering project against seemingly impossible odds,0.5859,positive,0,0
"'Goonies' cast, Steven Spielberg reunite and it's awesome",http://rss.cnn.com/~r/rss/cnn_topstories/~3/pgmYJiu7zPw/the-goonies-cast-reunion-orig-jk.cnn,"The cast of the 1985 classic movie ""The Goonies"" got together to raise money for The Center for Disaster Philanthropy. Steven Spielberg and Cyndi Lauper came to the party, too.",2020-04-28 19:48:07+00:00,rss/cnn_topstories,goonies cast steven spielberg reunite and its awesome the cast of the 1985 classic movie the goonies got together to raise money for the center for disaster philanthropy steven spielberg and cyndi lauper came to the party too,0.4019,positive,0,0
Landlords are bracing for a wave of rent defaults,http://rss.cnn.com/~r/rss/cnn_topstories/~3/7SPWtZj8yU4/index.html,Landlords across the country are anticipating fewer people will be able to pay rent in May than April. But they are even more worried about what comes in the months after.,2020-05-03 19:23:30+00:00,rss/cnn_topstories,landlords are bracing for a wave of rent defaults landlords across the country are anticipating fewer people will be able to pay rent in may than april but they are even more worried about what comes in the months after,-0.533,negative,0,0
US unemployment hasn't looked this bad since the 1930s,http://rss.cnn.com/~r/rss/cnn_topstories/~3/dU3h87yKFUc/index.html,"Since the middle of March, Americans have filed more than 30 million claims for their first week of unemployment benefits, sparking a crisis of joblessness that materialized almost overnight.",2020-05-03 14:55:52+00:00,rss/cnn_topstories,us unemployment hasnt looked this bad since the 1930s since the middle of march americans have filed more than 30 million claims for their first week of unemployment benefits sparking a crisis of joblessness that materialized almost overnight,-0.9086,negative,0,0
Your tributes to the people we've lost to Covid-19,http://rss.cnn.com/~r/rss/cnn_topstories/~3/4I-AZRjXe20/,,no date,rss/cnn_topstories,your tributes to the people weve lost to covid19 ,-0.3182,negative,0,0
Drug offers hope to some Covid-19 patients,http://rss.cnn.com/~r/rss/cnn_topstories/~3/GGz0c-hyvVQ/coronavirus-patients-remdesivir-fda-pkg-sidner-vpx.cnn,"The FDA has approved emergency use of the experimental drug remdesivir to treat hospitalized patients with severe Covid-19, but experts say more clinical trials are needed. CNN's Sara Sidner reports.",2020-05-02 22:14:21+00:00,rss/cnn_topstories,drug offers hope to some covid19 patients the fda has approved emergency use of the experimental drug remdesivir to treat hospitalized patients with severe covid19 but experts say more clinical trials are needed cnns sara sidner reports,0.2732,positive,0,0
This is how America's largest city deals with its dead,http://rss.cnn.com/~r/rss/cnn_topstories/~3/OJ9GnV2XPWU/index.html,"In his final moments, Ananda Mooliya reassured his wife and two sons that he was fine, though they could hear his labored breathing from the next room, over the sound of the TV.",2020-05-03 20:23:54+00:00,rss/cnn_topstories,this is how americas largest city deals with its dead in his final moments ananda mooliya reassured his wife and two sons that he was fine though they could hear his labored breathing from the next room over the sound of the tv,-0.2023,negative,0,0
30 brilliant gifts for Mom that will make her day,http://rss.cnn.com/~r/rss/cnn_topstories/~3/QVSwBLKdPeQ/index.html,,no date,rss/cnn_topstories,30 brilliant gifts for mom that will make her day ,0.5859,positive,0,0
Disney's new cloth masks feature Baby Yoda & others,http://rss.cnn.com/~r/rss/cnn_topstories/~3/JWlGBCb9liU/index.html,,no date,rss/cnn_topstories,disneys new cloth masks feature baby yoda  others ,0.0,neutral,0,0
The best noise-canceling headphones of 2020,http://rss.cnn.com/~r/rss/cnn_topstories/~3/HLHrMz-APl8/index.html,,no date,rss/cnn_topstories,the best noisecanceling headphones of 2020 ,0.6369,positive,0,0
20 Mother's Day gifts for the best mom in the world,http://rss.cnn.com/~r/rss/cnn_topstories/~3/rUqgtVaEKS4/index.html,,no date,rss/cnn_topstories,20 mothers day gifts for the best mom in the world ,0.6369,positive,0,0
"Top weekend sales: Brooklinen, Ancestry & more",http://rss.cnn.com/~r/rss/cnn_topstories/~3/jtwWQIB9iY0/index.html,,no date,rss/cnn_topstories,top weekend sales brooklinen ancestry  more ,0.2023,positive,0,0
Invasive giant hornets spotted in the US for the first time,http://rss.cnn.com/~r/rss/cnn_topstories/~3/-EA0oojYlX8/index.html,"Just when you thought 2020 could not get any worse, there are giant hornets with a venomous sting to add to the list of worries this year.",2020-05-03 20:04:15+00:00,rss/cnn_topstories,invasive giant hornets spotted in the us for the first time just when you thought 2020 could not get any worse there are giant hornets with a venomous sting to add to the list of worries this year,-0.0634,neutral,0,0
6 ways 'Never Have I Ever' busts Asian stereotypes,http://rss.cnn.com/~r/rss/cnn_topstories/~3/zSuwhyM-IIs/index.html,"""Never Have I Ever,"" the No. 1 trending show on Netflix, is rightfully being celebrated as a watershed moment for the representation of South Asians in Hollywood. But the 10-part series' real magic is how much it twists stereotypes within even that experience. Here are six ways it does so (warning, spoilers ahead):",2020-05-02 11:21:59+00:00,rss/cnn_topstories,6 ways never have i ever busts asian stereotypes never have i ever the no 1 trending show on netflix is rightfully being celebrated as a watershed moment for the representation of south asians in hollywood but the 10part series real magic is how much it twists stereotypes within even that experience here are six ways it does so warning spoilers ahead,-0.5306,negative,0,0
